17:42:17.507864 ens33 In  IP 192.168.1.135.2033 > 192.168.1.57.9443: Flags [S], seq 2470395181, win 65535, options [mss 1460,nop,wscale 8,nop,nop,sackOK], length 0
17:42:17.507912 ens33 Out IP 192.168.1.57.9443 > 192.168.1.135.2033: Flags [S.], seq 3221669790, ack 2470395182, win 64240, options [mss 1460,nop,nop,sackOK,nop,wscale 7], length 0
17:42:17.508584 ens33 In  IP 192.168.1.135.2033 > 192.168.1.57.9443: Flags [.], ack 1, win 255, length 0
17:42:17.508585 ens33 In  IP 192.168.1.135.2033 > 192.168.1.57.9443: Flags [P.], seq 1:5, ack 1, win 255, length 4
17:42:17.508637 ens33 Out IP 192.168.1.57.9443 > 192.168.1.135.2033: Flags [.], ack 5, win 502, length 0
17:42:20.509200 ens33 In  IP 192.168.1.135.2033 > 192.168.1.57.9443: Flags [P.], seq 5:9, ack 1, win 255, length 4
17:42:20.509231 ens33 Out IP 192.168.1.57.9443 > 192.168.1.135.2033: Flags [.], ack 9, win 502, length 0
17:42:23.510326 ens33 In  IP 192.168.1.135.2033 > 192.168.1.57.9443: Flags [P.], seq 9:13, ack 1, win 255, length 4
17:42:23.510357 ens33 Out IP 192.168.1.57.9443 > 192.168.1.135.2033: Flags [.], ack 13, win 502, length 0
17:42:25.268115 ens33 In  IP 192.168.1.135.1803 > 192.168.1.57.9443: Flags [.], seq 0:1, ack 1, win 255, length 1
17:42:25.268132 ens33 Out IP 192.168.1.57.9443 > 192.168.1.135.1803: Flags [.], ack 1, win 502, options [nop,nop,sack 1 {0:1}], length 0
17:42:26.511089 ens33 In  IP 192.168.1.135.2033 > 192.168.1.57.9443: Flags [P.], seq 13:17, ack 1, win 255, length 4
17:42:26.511121 ens33 Out IP 192.168.1.57.9443 > 192.168.1.135.2033: Flags [.], ack 17, win 502, length 0
17:42:29.511558 ens33 In  IP 192.168.1.135.2033 > 192.168.1.57.9443: Flags [P.], seq 17:19, ack 1, win 255, length 2
17:42:29.511587 ens33 Out IP 192.168.1.57.9443 > 192.168.1.135.2033: Flags [.], ack 19, win 502, length 0
